{"algorithm":"typaxis.machine-link-manifest/1","annotation_count":3,"cluster_receipt_sha256":"d36ab08acdbc51c681e223c206b71951b1640f449fa59c0aa21231423dcf603a","contract":"typaxis.contract/1.2","destination_count":1,"destinations":[{"anchor_id":"target","owner_node_id":2,"page_index":0,"point":{"x":655360,"y":655360}}],"display_sha256":"e737752bad9f920da86204969135e350f9369d2e9391f18403454e72627a17df","layout_epoch":{"admitted_resources_sha256":"e77bbff0297180e49223f2f7d529ea9eaa3333d7c2d0e1b8d9be31aa0c290497","document_sha256":"e293c2a4a411035b73c60f4b4d793edce6429edd56f58334323f688b420a13d9","resolved_input_sha256":"6906122af2bf484a8a7306f84ec7e755ed70956ea563fa7c0a9b181c7f657b9f","style_page_master_sha256":"f43b0a9c7953afcf889303370667d0efe55cbaf0703ad438a1c54f921ad9df45"},"layout_state_sha256":"986250d2c12afe83df62ab5c82e31d6833f60eb81f250d72ca195c5e2326cb2d","links":[{"link_node_id":3,"logical_cluster_count":3,"logical_cluster_end":3,"logical_cluster_start":0,"paragraph_node_id":1,"rectangles":[{"annotation_object_id":11,"line_ordinal":0,"page_index":0,"rect":{"height":917504,"width":1179648,"x":655360,"y":655360}}],"target":{"anchor_id":"target","anchor_owner_node_id":2,"kind":"internal"}},{"link_node_id":5,"logical_cluster_count":21,"logical_cluster_end":24,"logical_cluster_start":3,"paragraph_node_id":1,"rectangles":[{"annotation_object_id":12,"line_ordinal":0,"page_index":0,"rect":{"height":917504,"width":4010802,"x":1835008,"y":655360}},{"annotation_object_id":13,"line_ordinal":1,"page_index":0,"rect":{"height":917504,"width":5426379,"x":655360,"y":1572864}}],"target":{"kind":"external","uri":"https://example.test/Path?Q=1"}}],"object_count":13,"package_sha256":"71a455edc1c5556edd645219d99cc2285b4e908e037d962ce3e18e5e54addcbf","page_count":1,"pages":[{"annotation_count":3,"height":13107200,"page_index":0,"width":7208960}],"pdf_byte_length":4786,"pdf_sha256":"a0aa9c31f79773601c1d2d2ac13f78a4dc7e4ca99e9a1f0d78b2fe0c8bf725d6","policy_version":"typaxis.basic-link-policy/1","profile":"typaxis.machine-pdf/basic-document-1","selected_state_sha256":"e51dedf4e540fbe2adf0db73235c533820553709726bccc65482e04d0c7ec00e","usage_sha256":"630dd3e7df3f6a40f07292c72e30a2204503938d430cae1e27accec42b36bcfe"}
